module,panel_size,families,auc,perm_metric,perm_p
0,1,I-set domain containing,0.5146154491931498,0.5146154491931498,0.681592039800995
1,16,Non-clustered protocadherins;Calcium voltage-gated channel alpha1 subunits;M38 metallopeptidases;Contactins;Cyclic nucleotide gated channels;Intermediate filaments Type IV;Microtubule associated protein RP/EB family ;Copines;Dynein 1 complex subunits;Netrins;PPFI scaffold protein family;Alpha catenins;Ig-like cell adhesion molecule family;Adaptor related protein complex 2;Diacylglycerol kinases;Neuropeptide Y receptors,3.505333191042949,3.505333191042949,0.04477611940298507
2,16,Minor histocompatibility antigens;Alpha arrestins;Macro domain containing;CD molecules;ETS transcription factor family;C2-set domain containing;B7 family;ATPase phospholipid transporting;Cytohesins;Adaptor related protein complex 1;F-BAR domain containing;Deoxyribonucleoside kinases;DNA cross-link repair family;ESCRT-III associated factors;AH/BAR family Rho GTPase activating proteins;Immunoglobulin like domain containing,0.6357298305612477,0.6357298305612477,0.4577114427860697
3,16,ARF GTPase family;Adaptor related protein complex 3;BTB domain containing;FERM domain containing;FERRY complex subunits;Ankyrin repeat domain containing;Fibril associated collagens with interrupted triple helices;C2 domain containing;Antisense RNAs;F-boxes other;MicroRNA protein coding host genes;Misc;Long non-coding RNAs with non-systematic symbols;DNAJ (HSP40) heat shock proteins;Non-histone lysine methyltransferases;PIN-like domain superfamily,0.644865596043907,0.644865596043907,0.2835820895522388
4,3,DNA/RNA methyltransferases;Mediator complex;Armadillo like helical domain containing,0.2753963512988434,0.2753963512988434,0.6965174129353234
5,16,"Olfactory receptors, family 4;Flavoproteins;Lipases;Pantothenate kinase family;Olfactory receptors, family 8;Olfactory receptors, family 13;Lipocalins;Aldo-keto reductases;Interferons;Nudix hydrolase family;BRISC complex;Olfactory receptors, family 2;Olfactory receptors, family 10;Haloacid dehalogenase like hydrolase domain containing;PRAME family;Acyl-CoA synthetase family",0.5092916009467988,0.5092916009467988,0.9502487562189055
combined,68,"Non-clustered protocadherins;Calcium voltage-gated channel alpha1 subunits;M38 metallopeptidases;Contactins;Cyclic nucleotide gated channels;Intermediate filaments Type IV;Microtubule associated protein RP/EB family ;Copines;Dynein 1 complex subunits;Netrins;PPFI scaffold protein family;Alpha catenins;Ig-like cell adhesion molecule family;Adaptor related protein complex 2;Diacylglycerol kinases;Neuropeptide Y receptors;Minor histocompatibility antigens;Alpha arrestins;Macro domain containing;Olfactory receptors, family 4;ARF GTPase family;Flavoproteins;CD molecules;ETS transcription factor family;Adaptor related protein complex 3;BTB domain containing;FERM domain containing;FERRY complex subunits;C2-set domain containing;Ankyrin repeat domain containing;Lipases;Pantothenate kinase family;Fibril associated collagens with interrupted triple helices;Olfactory receptors, family 8;C2 domain containing;DNA/RNA methyltransferases;Olfactory receptors, family 13;B7 family;Antisense RNAs;F-boxes other;Lipocalins;I-set domain containing;MicroRNA protein coding host genes;Aldo-keto reductases;Interferons;ATPase phospholipid transporting;Nudix hydrolase family;Misc;Cytohesins;Adaptor related protein complex 1;F-BAR domain containing;Deoxyribonucleoside kinases;Long non-coding RNAs with non-systematic symbols;BRISC complex;Olfactory receptors, family 2;DNAJ (HSP40) heat shock proteins;Mediator complex;DNA cross-link repair family;Olfactory receptors, family 10;ESCRT-III associated factors;AH/BAR family Rho GTPase activating proteins;Non-histone lysine methyltransferases;Haloacid dehalogenase like hydrolase domain containing;Immunoglobulin like domain containing;PIN-like domain superfamily;PRAME family;Acyl-CoA synthetase family;Armadillo like helical domain containing",1.265651882361884,1.265651882361884,0.11442786069651742
